{
  "cases": [
    {
      "candidates": [
        {
          "proposal": {
            "base_source_sha256": "sha256:4227327f9d93e2a59a80a8b0dc175b382f4f0295405e8446f83829e3590513e1",
            "edit": {
              "end_line": 4,
              "replacement": [
                "  return value * 2 - 1;"
              ],
              "start_line": 4
            },
            "id": "sha256:75eb2e303d1582fa718b3bff54dd41f805f302a4187e78e5b8e766aeb575d5ce",
            "schema": "codeskeptic.patch-proposal/v1"
          },
          "rank": 1
        },
        {
          "proposal": {
            "base_source_sha256": "sha256:4227327f9d93e2a59a80a8b0dc175b382f4f0295405e8446f83829e3590513e1",
            "edit": {
              "end_line": 4,
              "replacement": [
                "  return value * 106;"
              ],
              "start_line": 4
            },
            "id": "sha256:fbce12b22d857a4b7147b9f88a2db2009fc6f09d7939a32d50f3154a3678d7f0",
            "schema": "codeskeptic.patch-proposal/v1"
          },
          "rank": 2
        },
        {
          "proposal": {
            "base_source_sha256": "sha256:4227327f9d93e2a59a80a8b0dc175b382f4f0295405e8446f83829e3590513e1",
            "edit": {
              "end_line": 4,
              "replacement": [
                "  return value * 107;"
              ],
              "start_line": 4
            },
            "id": "sha256:2e91a71f66c04341717577351952e40d63e3176e83ac6b3c86e1c503cc13a9cf",
            "schema": "codeskeptic.patch-proposal/v1"
          },
          "rank": 3
        },
        {
          "proposal": {
            "base_source_sha256": "sha256:4227327f9d93e2a59a80a8b0dc175b382f4f0295405e8446f83829e3590513e1",
            "edit": {
              "end_line": 4,
              "replacement": [
                "  return value * 108;"
              ],
              "start_line": 4
            },
            "id": "sha256:61dc07efc52a6086fa059096e9d08352bbae1b141fae82eac61a8087067d9657",
            "schema": "codeskeptic.patch-proposal/v1"
          },
          "rank": 4
        }
      ],
      "case": "e2-case-01"
    },
    {
      "candidates": [
        {
          "proposal": {
            "base_source_sha256": "sha256:6230199c61e1c94cea988a4bcdb8c71e225ca33832419a7c59027b5b177a7838",
            "edit": {
              "end_line": 4,
              "replacement": [
                "  return value * 3;"
              ],
              "start_line": 4
            },
            "id": "sha256:bfd3a436223f5fea65171a87e6b956f871298deb4cd36c5377f1a37aa5a0d58b",
            "schema": "codeskeptic.patch-proposal/v1"
          },
          "rank": 1
        },
        {
          "proposal": {
            "base_source_sha256": "sha256:6230199c61e1c94cea988a4bcdb8c71e225ca33832419a7c59027b5b177a7838",
            "edit": {
              "end_line": 4,
              "replacement": [
                "  return value * 110;"
              ],
              "start_line": 4
            },
            "id": "sha256:32c01b16620cc34658166f1b7b9e7071cc72bb063a661bcf7955434c95309f61",
            "schema": "codeskeptic.patch-proposal/v1"
          },
          "rank": 2
        },
        {
          "proposal": {
            "base_source_sha256": "sha256:6230199c61e1c94cea988a4bcdb8c71e225ca33832419a7c59027b5b177a7838",
            "edit": {
              "end_line": 4,
              "replacement": [
                "  return value * 111;"
              ],
              "start_line": 4
            },
            "id": "sha256:64ac714a553f71ce5d4dd0a36f055a79b940585b063e80663cbb046ba22587e1",
            "schema": "codeskeptic.patch-proposal/v1"
          },
          "rank": 3
        },
        {
          "proposal": {
            "base_source_sha256": "sha256:6230199c61e1c94cea988a4bcdb8c71e225ca33832419a7c59027b5b177a7838",
            "edit": {
              "end_line": 4,
              "replacement": [
                "  return value * 112;"
              ],
              "start_line": 4
            },
            "id": "sha256:e0476d506425e4867ac8c74c72b71544f780952a9bc466040448350942771f96",
            "schema": "codeskeptic.patch-proposal/v1"
          },
          "rank": 4
        }
      ],
      "case": "e2-case-02"
    },
    {
      "candidates": [
        {
          "proposal": {
            "base_source_sha256": "sha256:73c3c9645aa6dfef54fe1d875436f831868f4c181314a6dd1a093a4fdfa0c88d",
            "edit": {
              "end_line": 4,
              "replacement": [
                "  return value * 4 + 1;"
              ],
              "start_line": 4
            },
            "id": "sha256:4fcfb1941328d8fde2ae92e8cb05231733e145675f1f2ee89691442bcf20a6fd",
            "schema": "codeskeptic.patch-proposal/v1"
          },
          "rank": 1
        },
        {
          "proposal": {
            "base_source_sha256": "sha256:73c3c9645aa6dfef54fe1d875436f831868f4c181314a6dd1a093a4fdfa0c88d",
            "edit": {
              "end_line": 4,
              "replacement": [
                "  return value * 114;"
              ],
              "start_line": 4
            },
            "id": "sha256:8be732fbb02fca28e8dbdfcda54dd1696a1bed323c89f9aa7de3fffc095d8d68",
            "schema": "codeskeptic.patch-proposal/v1"
          },
          "rank": 2
        },
        {
          "proposal": {
            "base_source_sha256": "sha256:73c3c9645aa6dfef54fe1d875436f831868f4c181314a6dd1a093a4fdfa0c88d",
            "edit": {
              "end_line": 4,
              "replacement": [
                "  return value * 115;"
              ],
              "start_line": 4
            },
            "id": "sha256:f48e34d376d54f9c590349b673381487a67bd0266fd8d6a60b3d2a7272b8c148",
            "schema": "codeskeptic.patch-proposal/v1"
          },
          "rank": 3
        },
        {
          "proposal": {
            "base_source_sha256": "sha256:73c3c9645aa6dfef54fe1d875436f831868f4c181314a6dd1a093a4fdfa0c88d",
            "edit": {
              "end_line": 4,
              "replacement": [
                "  return value * 116;"
              ],
              "start_line": 4
            },
            "id": "sha256:0e8c32d7be081f9c17731296017b164e40ba5219b561e304d2b1b9eba8f42b36",
            "schema": "codeskeptic.patch-proposal/v1"
          },
          "rank": 4
        }
      ],
      "case": "e2-case-03"
    },
    {
      "candidates": [
        {
          "proposal": {
            "base_source_sha256": "sha256:689b8d65bf70fd5c9101c522e14805d612cdf3f41ff01129e35c96e86c57f02e",
            "edit": {
              "end_line": 4,
              "replacement": [
                "  return value * 5 + 2;"
              ],
              "start_line": 4
            },
            "id": "sha256:92639e4b76def8cb4d74e5c58336fab6b3bbc129dd5a249be98acd04fc871a35",
            "schema": "codeskeptic.patch-proposal/v1"
          },
          "rank": 1
        },
        {
          "proposal": {
            "base_source_sha256": "sha256:689b8d65bf70fd5c9101c522e14805d612cdf3f41ff01129e35c96e86c57f02e",
            "edit": {
              "end_line": 4,
              "replacement": [
                "  return value * 118;"
              ],
              "start_line": 4
            },
            "id": "sha256:735b7524b2bf651961372638932839d6447bd4be2d2a2597edbf0df07f1c5824",
            "schema": "codeskeptic.patch-proposal/v1"
          },
          "rank": 2
        },
        {
          "proposal": {
            "base_source_sha256": "sha256:689b8d65bf70fd5c9101c522e14805d612cdf3f41ff01129e35c96e86c57f02e",
            "edit": {
              "end_line": 4,
              "replacement": [
                "  return value * 119;"
              ],
              "start_line": 4
            },
            "id": "sha256:cad69dc054df83f6e0831efb967e649c05170bf9debd84d609210cda4ba6cefb",
            "schema": "codeskeptic.patch-proposal/v1"
          },
          "rank": 3
        },
        {
          "proposal": {
            "base_source_sha256": "sha256:689b8d65bf70fd5c9101c522e14805d612cdf3f41ff01129e35c96e86c57f02e",
            "edit": {
              "end_line": 4,
              "replacement": [
                "  return value * 120;"
              ],
              "start_line": 4
            },
            "id": "sha256:3d91fa0a079494144b9861e09446647037ad993102cbd4959d97a727a2e62e6b",
            "schema": "codeskeptic.patch-proposal/v1"
          },
          "rank": 4
        }
      ],
      "case": "e2-case-04"
    },
    {
      "candidates": [
        {
          "proposal": {
            "base_source_sha256": "sha256:2a8113b38915291dd02ec7a0e6d13c8779a167f218b51b5d01e8bb9203df746c",
            "edit": {
              "end_line": 4,
              "replacement": [
                "  return value * 121;"
              ],
              "start_line": 4
            },
            "id": "sha256:cb10ad0a2e28470ea22c200fbecbe68a905946b3cc7d5068861dd22a001feb0f",
            "schema": "codeskeptic.patch-proposal/v1"
          },
          "rank": 1
        },
        {
          "proposal": {
            "base_source_sha256": "sha256:2a8113b38915291dd02ec7a0e6d13c8779a167f218b51b5d01e8bb9203df746c",
            "edit": {
              "end_line": 4,
              "replacement": [
                "  return value * 6 - 2;"
              ],
              "start_line": 4
            },
            "id": "sha256:0bd61b180a38458162ad93eb7272eb11957ea7840ed85e73b93a05e2ad1e41d4",
            "schema": "codeskeptic.patch-proposal/v1"
          },
          "rank": 2
        },
        {
          "proposal": {
            "base_source_sha256": "sha256:2a8113b38915291dd02ec7a0e6d13c8779a167f218b51b5d01e8bb9203df746c",
            "edit": {
              "end_line": 4,
              "replacement": [
                "  return value * 123;"
              ],
              "start_line": 4
            },